{
  "opendpi": "1.0.0",
  "info": {
    "title": "Missing Component Ref",
    "version": "1.0.0"
  },
  "connections": {
    "database": {
      "host": "localhost:5432",
      "type": "postgresql"
    }
  },
  "ports": {
    "broken": {
      "description": "References non-existent component",
      "connections": [
        {
          "connection": "#/connections/database",
          "location": "broken"
        }
      ],
      "schema": {
        "$ref": "#/components/schemas/DoesNotExist"
      }
    }
  },
  "components": {
    "schemas": {
      "SomeSchema": {
        "type": "object"
      }
    }
  }
}